{
  "schemaVersion": 1,
  "kind": "operator_ecosystem_redundancy_audit",
  "observedAt": "2026-07-10T07:09:52+02:00",
  "scope": {
    "definition": "Operator organs named by Cabinet, plus WGX and the external GitHub/CI/runtime authority plane.",
    "repositoriesChecked": [
      "bureau",
      "grabowski",
      "cabinet",
      "lenskit",
      "steuerboard",
      "leitstand",
      "schauwerk",
      "chronik",
      "heimlern",
      "vibe-lab",
      "wgx",
      "metarepo"
    ],
    "liveChecks": [
      "git status and open pull requests for the target repositories",
      "user and system systemd service/timer inventory",
      "Grabowski deployment identity and worktree inventory",
      "cross-repository source/config references excluding documentation-only paths"
    ]
  },
  "evidenceRefs": [
    {
      "id": "ev-grabowski-runtime",
      "kind": "live_runtime",
      "reference": "grabowski_status and grabowski_context full; deployed head b69fc0d57a64bbc658deebfe4a707f1551e65c8c",
      "observedAt": "2026-07-10T06:58:00+02:00"
    },
    {
      "id": "ev-systemd-units",
      "kind": "live_runtime",
      "reference": "systemctl --user list-units --all --type=service --type=timer plus system unit inventory",
      "observedAt": "2026-07-10T07:03:00+02:00"
    },
    {
      "id": "ev-grabowski-worktrees",
      "kind": "live_repository",
      "reference": "git -C /home/alex/repos/grabowski worktree list --porcelain",
      "observedAt": "2026-07-10T07:05:00+02:00"
    },
    {
      "id": "ev-cabinet-boundary",
      "kind": "source_contract",
      "reference": "cabinet/README.md, cabinet/AGENTS.md, docs/blueprints/cabinet-role-boundary-v1.md",
      "observedAt": "2026-07-10T07:00:00+02:00"
    },
    {
      "id": "ev-bureau-boundary",
      "kind": "source_contract",
      "reference": "bureau/README.md and registry initiative BUR-2026-004",
      "observedAt": "2026-07-10T07:02:00+02:00"
    },
    {
      "id": "ev-organ-contracts",
      "kind": "source_contract",
      "reference": "steuerboard/README.md, schauwerk/README.md, chronik/README.md, heimlern/README.md, vibe-lab/README.md, metarepo/docs/system/heimgewebe-organismus.md",
      "observedAt": "2026-07-10T07:01:00+02:00"
    },
    {
      "id": "ev-cross-repo-consumers",
      "kind": "source_integration_scan",
      "reference": "bounded cross-repository scan of source, config, workflows, policy, schema and registry paths; docs/tests excluded",
      "observedAt": "2026-07-10T07:06:00+02:00"
    }
  ],
  "summary": {
    "coreKeep": [
      "bureau",
      "grabowski",
      "repobrief_lenskit",
      "github_ci_runtime"
    ],
    "keepAsDerivedSurface": [
      "cabinet",
      "leitstand",
      "schauwerk"
    ],
    "conditionalOrNarrow": [
      "steuerboard",
      "chronik",
      "heimlern",
      "vibe_lab",
      "wgx"
    ],
    "highestLeverage": "Reduce duplicated status/coordination paths before adding new organs or evidence formats.",
    "liveSignals": {
      "bureauActiveTimers": 10,
      "grabowskiWorktrees": 44,
      "grabowskiFailedTransientUnits": 21,
      "cabinetServiceActive": true,
      "leitstandServiceActive": true,
      "rlensServiceActive": true,
      "schauwerkKeepaliveTimerActive": true,
      "chronikLocalUnitsObserved": 0,
      "heimlernLocalUnitsObserved": 0,
      "vibeLabLocalUnitsObserved": 0
    }
  },
  "organs": [
    {
      "id": "bureau",
      "authority": "Commitments, ordering, dependencies, claims, dispatch envelopes, completion verification and receipts.",
      "observedConsumers": [
        "Grabowski dispatch and task handoff",
        "Leitstand operator snapshots",
        "Cabinet bridge and coherence work",
        "human operator sessions"
      ],
      "duplicateData": [
        "queue and task status are restated in Cabinet, Leitstand and narrative reports",
        "ten active timer lanes produce overlapping discovery, curation, verification, review and bridge projections"
      ],
      "manualMaintenance": {
        "level": "high",
        "drivers": [
          "large Git registry",
          "many operational organs and timer units",
          "frequent queue closeout pull requests"
        ]
      },
      "shutdown": {
        "class": "core_not_replaceable",
        "conditions": [
          "replace cross-repository claims and deterministic completion receipts",
          "migrate all active dispatch and queue consumers"
        ],
        "partialShutdown": "Individual Ops timers are highly disableable because Bureau Core remains authoritative."
      },
      "recommendation": "Keep Bureau Core. Audit and consolidate timer lanes; prefer one scheduler pipeline with explicit stages over independent periodic organs.",
      "confidence": 0.96,
      "evidenceClass": [
        "live_runtime",
        "source_contract",
        "cross_repo_reference"
      ]
    },
    {
      "id": "grabowski",
      "authority": "Local and fleet execution, processes, resource leases, durable tasks, workers and runtime effects.",
      "observedConsumers": [
        "ChatGPT operator relay",
        "Bureau dispatch adapter",
        "Leitstand operator snapshots",
        "repository and runtime maintenance workflows"
      ],
      "duplicateData": [
        "task state is also projected into Bureau and Leitstand",
        "multiple old worktrees and transient task units retain historical execution state"
      ],
      "manualMaintenance": {
        "level": "high",
        "drivers": [
          "44 linked worktrees observed",
          "21 failed or bad-setting transient task units observed",
          "multiple watchdog and Dauersong timer lanes"
        ]
      },
      "shutdown": {
        "class": "core_not_replaceable",
        "conditions": [
          "replace typed local/fleet execution and audited mutation paths"
        ],
        "partialShutdown": "Optional autonomous, watchdog and historical transient-unit surfaces can be disabled independently."
      },
      "recommendation": "Keep the operator core. Prioritize lifecycle cleanup and task reconciliation over adding more execution roles or receipts.",
      "confidence": 0.99,
      "evidenceClass": [
        "live_runtime",
        "deployment_identity",
        "worktree_inventory"
      ]
    },
    {
      "id": "repobrief_lenskit",
      "authority": "No domain truth; produces source-bound repository context, citations, snapshots and freshness identity.",
      "observedConsumers": [
        "Grabowski context tools",
        "Cabinet external manifest ingestion",
        "LLM and review workflows",
        "rLens web UI"
      ],
      "duplicateData": [
        "several report, sidecar, bundle and projected context formats describe the same source tree",
        "Cabinet and agent workflows may retain additional copies of generated artifacts"
      ],
      "manualMaintenance": {
        "level": "medium_high",
        "drivers": [
          "artifact format count",
          "freshness and publication automation",
          "repository-wide snapshot storage"
        ]
      },
      "shutdown": {
        "class": "replaceable_with_quality_loss",
        "conditions": [
          "agents fall back to direct repository reads",
          "citation and freshness guarantees are accepted as weaker"
        ],
        "partialShutdown": "UI and redundant export formats can be removed while keeping query, range and context-pack primitives."
      },
      "recommendation": "Keep the context primitives. Consolidate daily use around manifest, context pack and freshness identity; make full reports diagnostic outputs.",
      "confidence": 0.94,
      "evidenceClass": [
        "live_runtime",
        "source_contract",
        "cross_repo_reference"
      ]
    },
    {
      "id": "cabinet",
      "authority": "Meaning, evidence framing, readable decisions, map semantics and read-only coherence findings.",
      "observedConsumers": [
        "human ecosystem orientation",
        "Bureau bridge previews",
        "Schauwerk map rendering",
        "Leitstand/Cabinet visual surfaces"
      ],
      "duplicateData": [
        "two ecosystem maps, graph registries, seed files, claims and narrative blueprints overlap",
        "legacy rooms and active rooms preserve parallel navigation structures",
        "status wording can duplicate source-system projections"
      ],
      "manualMaintenance": {
        "level": "high",
        "drivers": [
          "manual semantic maps and blueprints",
          "registry plus narrative synchronization",
          "large contract and validation surface"
        ]
      },
      "shutdown": {
        "class": "service_disableable_repo_useful",
        "conditions": [
          "retain decisions and authority map in version control"
        ],
        "partialShutdown": "The active Cabinet service can stop without losing GitHub, Bureau, CI or runtime truth."
      },
      "recommendation": "Keep one semantic authority matrix and one generated map. Freeze new rooms and duplicate projections until existing paths are consolidated.",
      "confidence": 0.95,
      "evidenceClass": [
        "live_runtime",
        "source_contract",
        "repository_structure"
      ]
    },
    {
      "id": "steuerboard",
      "authority": "Action-specific readiness is claimed externally, while its own contract says it is not a canonical source of truth.",
      "observedConsumers": [
        "Grabowski operator context routing",
        "Cabinet repository observation policies",
        "Bureau references to readiness and repo-state assessment"
      ],
      "duplicateData": [
        "repository status, branch drift and action readiness overlap GitHub, Grabowski and Bureau",
        "two bounded mutators overlap Grabowski Git execution"
      ],
      "manualMaintenance": {
        "level": "high",
        "drivers": [
          "broad CLI and schema surface",